{
  "$schema": "https://json-schema.org/draft/2020-12/schema",
  "$id": "https://github.com/wellmanifest/new-project/governance/intent.schema.json",
  "title": "new-project ticket intent",
  "type": "object",
  "additionalProperties": false,
  "required": ["schema", "ticket", "summary", "workstream", "allowedPaths", "forbiddenPaths", "stacks", "dependsOn", "conflictsWith", "integrationTicket"],
  "properties": {
    "schema": { "const": "new-project.intent/v2" },
    "ticket": { "type": "string", "pattern": "^ticket-[0-9]{3}$" },
    "summary": { "type": "string", "minLength": 1 },
    "workstream": { "type": "string", "pattern": "^[a-z0-9][a-z0-9-]*$" },
    "allowedPaths": { "type": "array", "items": { "type": "string", "minLength": 1 }, "minItems": 1, "uniqueItems": true },
    "forbiddenPaths": { "type": "array", "items": { "type": "string", "minLength": 1 }, "uniqueItems": true },
    "stacks": { "type": "array", "items": { "type": "string", "minLength": 1 }, "uniqueItems": true },
    "dependsOn": { "type": "array", "items": { "type": "string", "pattern": "^ticket-[0-9]{3}$" }, "uniqueItems": true },
    "conflictsWith": { "type": "array", "items": { "type": "string", "pattern": "^ticket-[0-9]{3}$" }, "uniqueItems": true },
    "integrationTicket": {
      "oneOf": [
        { "type": "null" },
        { "type": "string", "pattern": "^ticket-[0-9]{3}$" }
      ]
    }
  }
}
