{
  "schema": "new-project.intent/v2",
  "ticket": "ticket-032",
  "summary": "Coordinate stable, scoped, symbol-aware, concise, and schema-safe intent analysis fixes",
  "workstream": "integration",
  "allowedPaths": [
    "project/ticket-032/**",
    "TODO.md",
    "project/TICKETS.md"
  ],
  "forbiddenPaths": [
    "project/ticket-*/user-*.md",
    "src/**",
    "python/**",
    "test/**",
    "package.json",
    "package-lock.json",
    "tsconfig.json"
  ],
  "stacks": ["node", "docker"],
  "dependsOn": [],
  "conflictsWith": [],
  "integrationTicket": null
}
